ID;Num_Doc;Statement;Type
476:5;Jupyter_Lab_3901;"1, but with one option being ""automatically detect"" :)";Non-Argument
476:7;Jupyter_Lab_3901;"* if I open a .py file in Jupyterlab (say `constants.py`) it immediately opens with ""unsaved changes"" without any edits.![constants](https://user-images.githubusercontent.com/4811862/36441516-eab8bbf6-1640-11e8-95d5-56cd09c7ecf0.PNG)* if I then save the file, `git status` will note that the file was modified. `git diff` will give this";Premise
476:9;Jupyter_Lab_3901;"Text editor writes LF vs CRLF line endings on Windows?I'm using Windows 7 Professional and observe the following:";Claim
476:10;Jupyter_Lab_3901;we are using LF for all line endings,;Claim
476:11;Jupyter_Lab_3901;so what you are seeing is expected.  We could guess the line endings of the file and set it accordingly.;Premise
476:12;Jupyter_Lab_3901;I'm not sure how I feel about trying to guess line endings automatically, particularly in a browser environment.;Claim
476:13;Jupyter_Lab_3901;I'd prefer to just make it a user setting;Claim
476:14;Jupyter_Lab_3901;I'd just like to point out vscode's solution is to have an option on the status bar.;Claim
476:15;Jupyter_Lab_3901;image;Premise
477:4;Jupyter_Lab_4044;"Issue reorganizing tabsSorry if this is a duplicate";Claim
477:5;Jupyter_Lab_4044;but I couldn't find a similar issue.;Premise
477:6;Jupyter_Lab_4044;When I have two tabs open in different frames then its impossible to get them back into the same frame.;Claim
477:7;Jupyter_Lab_4044;"Find attached a gif demonstrating the issue![jupyterlab_tabs](https://user-images.githubusercontent.com/29157027/36749493-2a7bd026-1bb8-11e8-8414-0ce285d5aef0.gif)";Premise
477:8;Jupyter_Lab_4044;dragging to the middle of the of the target tab has the behavior you're looking for.;Claim
477:9;Jupyter_Lab_4044;From the docs: http://jupyterlab.readthedocs.io/en/latest/user/interface.html#main-work-area.;Premise
477:10;Jupyter_Lab_4044;Closing this for now.;Claim
478:2;Jupyter_Lab_4118;@damianavila says this is a  https://github.com/Anaconda-Platform/nb_conda_kernels issue;Claim
478:5;Jupyter_Lab_4118;I'm guessing ipykenrels parses all the conda environments as named `Python [conda env:foo]` but this means I can't read the name of the kernel;Claim
478:6;Jupyter_Lab_4118;[screen shot;Premise
478:8;Jupyter_Lab_4118;technically it is not (although that can be discussed) :wink:;Claim
478:9;Jupyter_Lab_4118;but I thought jupyterlab was able to show large names in the icons... am I missing something @blink1073?;Claim
478:11;Jupyter_Lab_4118;to move conversation to https://github.com/jupyterlab/jupyterlab/issues/3795.;Premise
478:12;Jupyter_Lab_4118;Conda Env Kernels Can't Be Read;Claim
478:13;Jupyter_Lab_4118;Closing;Claim
478:14;Jupyter_Lab_4118;We display only one line but offer the rest as a tooltip;Claim
479:2;Jupyter_Lab_4137;"Something like this?![new-tab](https://user-images.githubusercontent.com/591645/37437612-705bf1b0-27ee-11e8-9ad3-5c4bc2df19d2.gif)The add icon (`jp-AddIcon`) is just a placeholder. It would probably be better to use something similar to the [font-awesome external-link-alt icon](https://fontawesome.com/icons/external-link-alt?style=solid)";Premise
479:3;Jupyter_Lab_4137;Fixed by #4315, thanks;Claim
479:4;Jupyter_Lab_4137;I have an HTML page that I would like to open in a new browser tab.;Claim
479:5;Jupyter_Lab_4137;![image](https://user-images.githubusercontent.com/51059/37108170-503bce36-2204-11e8-9f41-cc9ce80f8aa4.png);Premise
479:6;Jupyter_Lab_4137;Yea that looks good!;Claim
479:7;Jupyter_Lab_4137;Would be great to have an option to open in a new browser tab;Claim
479:8;Jupyter_Lab_4137;Open In Browser Option;Claim
479:9;Jupyter_Lab_4137;Right now the only options are to download or to view in lab:;Premise
480:3;Jupyter_Lab_4211;currently the markdown coloring does suggest they should render differently, but currently it looks like they are just rendered to be bullets.;Claim
480:4;Jupyter_Lab_4211;"Markdown checkboxes/task listsIs it intended to show github style checkboxes via the markdown preview?https://help.github.com/articles/basic-writing-and-formatting-syntax/#task-lists![image](https://user-images.githubusercontent.com/16297104/37629718-9caa287e-2b9d-11e8-99a4-7d044840379c.png)for reference github:```- [ ] test- [x] test2```- [ ] test- [x] test2";Premise
480:5;Jupyter_Lab_4211;Also, for a good implementation the taskLists would need to support editing the markdown itself - i.e. the markdown cells would be editable by clicking on the rendered text's checkbox. Which will be custom for jupyterlab.;Premise
480:6;Jupyter_Lab_4211;Note that the `codemirror` library understands taskLists and shows syntax highlighting for taskLists, but the [marked](https://github.com/markedjs/marked) library which is used for rendering the markdown does not seem to support taskLists.;Premise
481:3;Jupyter_Lab_4250;Hope I did not overlook some open issue reporting this.;Claim
481:4;Jupyter_Lab_4250;My current workaround is to move up one level -> click on any file -> Paste -> drag&drop previously copied file into the desired (empty) folder.;Claim
481:5;Jupyter_Lab_4250;If one copies a file and goes into some empty folder, it is not possible to paste the file. The context menu does not show up for right-clicks on empty areas (e.g. the white space underneath the file list);Premise
481:6;Jupyter_Lab_4250;this is indeed a duplicate of;Claim
482:2;Jupyter_Lab_4257;"Would it be a good idea to add a ""New Console for Editor"" in the right-click file tab menu for editor tabs";Claim
482:3;Jupyter_Lab_4257;"If I want to open a new console for the file I'm working on in the file editor, I have to go in ""File->New Console for Editor"", but I always *instinctively* first right-click on to the file tab,  , where I can rename the file and open a new view the file, but not open a new console. Then I realise I have to go the top menu bar.";Premise
482:4;Jupyter_Lab_4257;"I would expect to have the ""Markdown Preview"" avalaible along ""Rename Markdown file"" and ""New View for Markdown file"" in the right-click menu of the file tab.";Claim
482:6;Jupyter_Lab_4257;New console for editor from file tab;Claim
483:2;Jupyter_Lab_4273;This happens in 0.34.7 as well;Claim
483:6;Jupyter_Lab_4273;How can we tell if it was an OOM problem?;Non-Argument
483:10;Jupyter_Lab_4273;And as with any issues, help is welcome! If anyone wants to take this up, please comment on the issue so that work isn't duplicated.;Non-Argument
483:14;Jupyter_Lab_4273;Sometimes when running a notebook the kernal restarts (in my case due to a OOM issue) but does not give the user any message. The cell will still show an asterisk, as if its running, but only when the user hovers the mouse over the circle at the top right, will it show that the kernal is restarting.;Premise
483:15;Jupyter_Lab_4273;I would expect a larger warning to the user, either in the current cell, or at the top of the notebook, to let them now some issue has occurred.;Claim
483:16;Jupyter_Lab_4273;img;Premise
483:17;Jupyter_Lab_4273;Note for plain old notebook, there's a simple popup for OOM/restarted kernel, which should be informative enough.;Claim
483:18;Jupyter_Lab_4273;I'd like to see more details;Claim
483:19;Jupyter_Lab_4273;as to why the kernel has had to restart. Some sort of stack trace from what the kernel was trying to execute.;Premise
483:20;Jupyter_Lab_4273;if it was an OOM, it's killed suddenly without a stack trace, IIRC;Claim
483:21;Jupyter_Lab_4273;That would be great,;Claim
483:22;Jupyter_Lab_4273;With our current infrastructure, I'm not sure you could easily.;Claim
483:24;Jupyter_Lab_4273;The process is gone and we just notice it no longer is responding to heartbeats;Claim
483:25;Jupyter_Lab_4273;that looks like quite the rabbit-hole;Claim
483:26;Jupyter_Lab_4273;I'd be quite happy if we can solve this separately.;Claim
483:27;Jupyter_Lab_4273;I've never used TypeScript or JavaScript, but I'll see if I can help.;Claim
483:28;Jupyter_Lab_4273;here is where that message is displayed in the classic notebook;Claim
483:29;Jupyter_Lab_4273;https://github.com/jupyter/notebook/blob/eea37a6b2110e0b8a5491f17e241fa3c8aecb5f7/notebook/static/notebook/js/notificationarea.js#L122-L146;Premise
483:30;Jupyter_Lab_4273;https://github.com/jupyter/notebook/blob/eea37a6b2110e0b8a5491f17e241fa3c8aecb5f7/notebook/static/services/kernels/kernel.js#L1106-L1113;Premise
483:31;Jupyter_Lab_4273;it is triggered here;Claim
483:32;Jupyter_Lab_4273;I can't use the newly started kernel;Claim
483:33;Jupyter_Lab_4273;It seems that killing the kernel process so that it autostarts does not work in jlab;Premise
483:34;Jupyter_Lab_4273;Some of the jupyter docs for [the architecture](https://jupyter.readthedocs.io/en/latest/architecture/how_jupyter_ipython_work.html) were really helpful for understanding where the limitation lies;Claim
483:35;Jupyter_Lab_4273;I worked on this and many other things in #4724, but that turned into a much more ambitious project that should be postponed until after 1.0. I still plan to look again at this specific issue to investigate solving just it (https://github.com/jupyterlab/jupyterlab/issues/4748 is the 1.0 issue for this, though perhaps this should be the 1.0 issue and that should be closed as a duplicate);Claim
484:2;Jupyter_Lab_4603;I'd like to take this opportunity to get more familiar with the codebase if nobody is assigned to the issue yet.;Claim
484:3;Jupyter_Lab_4603;Please, go for it. No one is working on this right now that we know of.;Non-Argument
484:6;Jupyter_Lab_4603;I think the proper behavior would allow dragging a non-active cell by simply dragging, without having to click to make it active first.;Claim
484:7;Jupyter_Lab_4603;"Clicking and dragging a non-active cell only selects it, but does not allow the dragNotice that the first time I try to drag the non-active cell, it becomes active but doesn't drag. I have to try dragging it a second time (after it has become active) to have the drag recognized.![debug](https://user-images.githubusercontent.com/192614/40219121-f7654d34-5a28-11e8-9909-5b80c35931c6.gif)";Premise
484:8;Jupyter_Lab_4603;It's a bit tricky;Claim
484:9;Jupyter_Lab_4603;because of supporting drag and drop.;Premise
484:10;Jupyter_Lab_4603;The event and mouse handling for the notebook is here: https://github.com/jupyterlab/jupyterlab/blob/077a1df13a1d69da88380184e6e040140d34c7e9/packages/notebook/src/widget.ts#L1114;Premise
484:11;Jupyter_Lab_4603;Seems like it's not possible to assign myself to the issue;Claim
484:12;Jupyter_Lab_4603;so I just left a comment to note that I'm working on it right now.;Premise
485:2;Jupyter_Lab_4609;"Hi,I would like to help with this, but I'm not sure which CSS file should be edited. Is it [this one]";Claim
485:3;Jupyter_Lab_4609;That looks like the right one to me. Does it work?;Claim
485:4;Jupyter_Lab_4609;Do you see why the font size is smaller? Is it that there is some `<code>` css accidentally overriding things?;Non-Argument
485:8;Jupyter_Lab_4609;"So one way to do it is to override font-size for code in the headings with a more specific selector: `.jp-RenderedHTMLCommon h1 code  { font-size: unset; }`? Similarly for h2, h3, etc.";Claim
485:9;Jupyter_Lab_4609;"I agree that is probably the easiest way.";Claim
485:10;Jupyter_Lab_4609;"Font size of codeblocks of jupyterlab is inconsistent with jupyter notebook.In jupyter notebook the font size of codeblock matched the title size, however jupyterlab does not.";Claim
485:11;Jupyter_Lab_4609;"Here's the following markdown rendered in both jupyterlab and jupyter notebook.```markdown# Hello `Codeblock`!## Hello `Codeblock`!### Hello `Codeblock`!#### Hello `Codeblock`!##### Hello `Codeblock`!```<img width=""720"" alt=""jupyterlab_codeblock"" src=""https://user-images.githubusercontent.com/4233072/40281513-f5b45c6a-5c9d-11e8-879c-4ab7f7e7ded2.png""><img width=""403"" alt=""jupyter_notebook_codeblock"" src=""https://user-images.githubusercontent.com/4233072/40281514-f5df957e-5c9d-11e8-8ff1-716718ac0c75.png"">";Premise
485:12;Jupyter_Lab_4609;I'm not that far yet. Right now I'm trying to figure out how the markdown is rendered. DevTools in Chrome are not useful,;Claim
485:13;Jupyter_Lab_4609;because render output is not just simple html element.;Premise
485:14;Jupyter_Lab_4609;Great question - it can be a bit tricky. The markdown cells render their content here;Claim
485:17;Jupyter_Lab_4609;Basically, it constructs a markdown mime message (just like if it was a markdown display type in an output), and then asks the markdown renderer to render it.;Premise
485:19;Jupyter_Lab_4609;However, I wonder if the real problem is that some *other* package's css styling is being misapplied here.;Premise
485:20;Jupyter_Lab_4609;That's why I asked my question about if it seems that the fontsize is coming from some other overly-broad css somewhere;Claim
485:21;Jupyter_Lab_4609;"It looks like, that the final rule applied to <code> is the .jp-RenderedHTMLCommon pre, .jp-RenderedHTMLCommon code class. And the font-size value is font-size: var(--jp-code-font-size);";Claim
485:22;Jupyter_Lab_4609;![screen](https://user-images.githubusercontent.com/2290566/40328240-fbd3fb5c-5d45-11e8-8043-63d677875c24.jpg);Premise
485:23;Jupyter_Lab_4609;The value for h1 is not applied,;Claim
485:24;Jupyter_Lab_4609;probably because the selector for code is more specific.;Premise
485:25;Jupyter_Lab_4609;That's why that package's CSS style is the one used for the markdown: https://github.com/jupyterlab/jupyterlab/blob/master/packages/rendermime/style/index.css;Claim
485:26;Jupyter_Lab_4609;The actual renderer is here: https://github.com/jupyterlab/jupyterlab/blob/e377acd19b1bb13dfd76d65d2e7210938e273ec0/packages/rendermime/src/renderers.ts#L301;Premise
486:2;Jupyter_Lab_4648;To collect all relevant information here I'll repost @ian-r-rose's [comment](https://github.com/jupyterlab/jupyterlab/issues/4608#issuecomment-390686374):;Non-Argument
486:5;Jupyter_Lab_4648;Thanks for tracking the meta-issue @dhirschfeld;Non-Argument
486:6;Jupyter_Lab_4648;This has cropped up on a number of occasions but there isn't really an issue which simply requests the ability to configure the fonts in the jupyterlab settings.;Claim
486:7;Jupyter_Lab_4648;#4013 can be closed;Claim
486:8;Jupyter_Lab_4648;as implementing this feature will provide the requested simple way of changing the font characteristics.;Premise
486:9;Jupyter_Lab_4648;#3899 and #4084 would both prefer Consolas on Windows.;Claim
486:10;Jupyter_Lab_4648;Since the decision in #4084 is to not provide platform default fonts both of these can be closed in favour of this feature request which would enable the user to change this for themselves.;Premise
486:11;Jupyter_Lab_4648;#4608 can be closed;Claim
486:12;Jupyter_Lab_4648;as the question has been [answered](https://github.com/jupyterlab/jupyterlab/issues/4608#issuecomment-390431897) and this feature was probably want the user was actually after;Premise
486:14;Jupyter_Lab_4648;I was looking for an issue where I could add my :+1: and found it scattered about several with none explicitly requesting the ability to configure fonts in the settings.;Claim
486:15;Jupyter_Lab_4648;I agree that Source Code Pro (Jupyter Lab) is not as good as Consolas (Jupyter Notebook) on Windows in terms of readability.;Claim
486:16;Jupyter_Lab_4648;. Therefore, I would really appreciate to have a config option as this is one of the few things that is still keeping me from fully switching to Jupyter Lab;Premise
486:17;Jupyter_Lab_4648;I think all the issues linked here can also be closed.;Claim
486:18;Jupyter_Lab_4648;I'll go ahead and close this.;Claim
486:19;Jupyter_Lab_4648;Now that #4673 is merged;Premise
486:20;Jupyter_Lab_4648;Feature Request: Ability to configure fonts in the settings;Claim
487:3;Jupyter_Lab_4691;"good catch!";Non-Argument
487:4;Jupyter_Lab_4691;. We should restore that padding in the CSS.;Claim
487:5;Jupyter_Lab_4691;"Rendered markdown has lost its paddingLooks like the context/main area widget refactor has given us some style regressions in the rendered markdown widget. It once had a generous padding, now the rendered markdown goes to the edge of the widget";Premise
487:6;Jupyter_Lab_4691;even worse,;Claim
487:7;Jupyter_Lab_4691;scrolling is broken for rendered markdown.;Premise
488:3;Jupyter_Lab_4730;Cool, I didn't know that! Let's change this issue to documenting this.;Non-Argument
488:4;Jupyter_Lab_4730;I think that should be another issue. It should still be possible to disable/change this behavior. ;Claim
488:5;Jupyter_Lab_4730;Okay, switching the title back, then;Non-Argument
488:9;Jupyter_Lab_4730;"Can't disable built-in Find barI would like to completely disable the search bar that shows up when pressing `Command + F`:";Claim
488:10;Jupyter_Lab_4730;this doesn't seem to be possible from the shortcuts menu.;Claim
488:11;Jupyter_Lab_4730;if you press ctrl-F twice, then it goes to the browser.;Claim
488:12;Jupyter_Lab_4730;I think we'd need to (a) figure out the way to disable the searching in CodeMirror and (b) expose an option to the user to turn off searching.;Claim
488:13;Jupyter_Lab_4730;I think we should document the ctrl F twice way of getting past the codemirror search.;Claim
488:14;Jupyter_Lab_4730;@cquah has pointed out that this can probably be closed;Claim
488:15;Jupyter_Lab_4730;#5795 and subsequent ctrl+f PRs have merged!;Premise
488:16;Jupyter_Lab_4730;Fixed by #5795 and friends;Claim
488:17;Jupyter_Lab_4730;"I mean this one:![41129190-cbd83fa8-6a65-11e8-9872-9397d818f482](https://user-images.githubusercontent.com/6897215/41438524-5f7dd760-6fdc-11e8-9d5a-091358d80781.png)";Premise
489:4;Jupyter_Lab_4867;Dark theme scroll bar doesn't seem to match the rest of the dark theme, perhaps a dark gray or black background with gray scroll (instead of gray on off-white);Claim
489:5;Jupyter_Lab_4867;<img;Premise
489:6;Jupyter_Lab_4867;We have tried to fix this in the past and it is really painful:;Claim
489:7;Jupyter_Lab_4867;"Browsers style scrollbars themselves and make very subtle contextualdecisions. For example on a Mac, scroll bars hide/show dynamically andautomatically change colors based on the background they are above.* Styling scrollbars can be done in CSS but it is awkward and you end upwith style bars that look out of place on some OS/browser combinations.* Most importantly, if you style them by hand you disable the niceauto-styling and auto-hiding some browsers do, so it ends up looking worsefor a lot of folks.";Premise
489:8;Jupyter_Lab_4867;"I would be open to some one exploring different options, but it would haveto address these points and be tested on all OS/browser combinations.";Claim
489:9;Jupyter_Lab_4867;"heother option is to begin implementing our own scrollbars (a huge amount ofwork and difficult with accessibility)";Claim
489:10;Jupyter_Lab_4867;Closing;Claim
489:11;Jupyter_Lab_4867;as a duplicate of #3008.;Premise
490:2;Jupyter_Lab_4876;? I really, really miss this in jupyterlab;Claim
490:8;Jupyter_Lab_4876;"Thanks @ian-r-rose!";Non-Argument
490:9;Jupyter_Lab_4876;Jupyterlab currently does the first of these but not the second. The second would be very nice to have!;Claim
490:10;Jupyter_Lab_4876;"Autocompletion of local tokens in notebook cellsIn Jupyter Notebook, pressing TAB will autocomplete:";Claim
490:11;Jupyter_Lab_4876;we need to settle this and make it work before 1.0 (it falls under the feature parity;Claim
490:12;Jupyter_Lab_4876;As this is the default behavior in the classic notebook;Premise
490:13;Jupyter_Lab_4876;I think this is implemented by [notebook/notebook/static/notebook/js/contexthint.js];Claim
490:14;Jupyter_Lab_4876;which is called and merged with kernel completions by [notebook/notebook/static/notebook/js/completer.js];Claim
490:15;Jupyter_Lab_4876;I can't figure out what is the correct place to add similar functionality to JupyterLab.;Claim
490:16;Jupyter_Lab_4876;I assume it involves one of (or probably more than one of) the jupyterlab/packages codeeditor, codemirror, and completer.;Claim
490:17;Jupyter_Lab_4876;If you are curious and want to work on this issue, here are some hints. I hope you find them helpful.;Claim
490:18;Jupyter_Lab_4876;Since only one completer ever appears on the screen, there is a completion manager (which can be required by an extension by requiring the token `ICompletionManager`) that handles the creation and disposal of completer widgets. (*cf.* https://github.com/jupyterlab/jupyterlab/blob/master/packages/completer-extension/src/index.ts#L75-L107);Premise
490:20;Jupyter_Lab_4876;if you wanted to support *both* the kernel's completion responses and a local tokenizer's list of tokens, you could either sub-class `KernelConnector` and do some extra work in the `fetch()` method, or you could compose a new class that takes a `KernelConnector` and uses that internally in its own `fetch()` method.;Claim
490:21;Jupyter_Lab_4876;. It doesn't do much except give you stubs for the data connector interface's required methods;Claim
490:23;Jupyter_Lab_4876;by #5049;Premise
490:24;Jupyter_Lab_4876;Fixed;Claim
491:3;Jupyter_Lab_4945;"Notes to self:Add a `tabBars` iterator to our shell.On context menu event in Application:- If it is a tab bar, emit `mousedown` and `mouseup` events, then find the current tab and send an activate request to the owner.- Otherwise, send `mousedown` and `mouseup` events to the target, and let the widget handle it";Non-Argument
491:4;Jupyter_Lab_4945;I'm pretty sure this is fixed in master;Claim
491:6;Jupyter_Lab_4945;Does the tab/notebook actually need to be activated to rename it by right-clicking?;Non-Argument
491:9;Jupyter_Lab_4945;This is counter-intuitive, and yes I renamed the wrong notebook and then noticed what happened.;Claim
491:10;Jupyter_Lab_4945;"Right-click->""Rename Notebook..."" on ""inactive"" tab prompts to rename ""active"" notebookHovering over any tab shows the details for that tab (super!).  However, right-clicking and selecting ""Rename Notebook..."" for an ""inactive"" tab doesn't pop-up a rename for that notebook.  The pop-up is to rename the ""active"" notebook.";Premise
491:11;Jupyter_Lab_4945;The issue here is that we are intercepting the right click event for our menu, and preventing the tab from being activated.;Claim
491:12;Jupyter_Lab_4945;I don't think this is fixed.;Claim
491:13;Jupyter_Lab_4945;This also came up in #4500 and #4529.;Claim
491:14;Jupyter_Lab_4945;#4590 is an attempt to fix the problem, but I am not sure that it a general enough fix for what we need.;Claim
491:15;Jupyter_Lab_4945;It may be that we decide this is a confusing enough behavior that we *do* activate them on right-click, however.;Claim
491:16;Jupyter_Lab_4945;It would be nice to be able to pass in the widget that received the right-click to the command, but that would be kind of tricky to implement with the current setup.;Claim
491:17;Jupyter_Lab_4945;For what it's worth, neither Firefox nor Chrome activate a tab upon right-clicking;Premise
491:18;Jupyter_Lab_4945;Currently the `Rename` command works on the active notebook, so it needs to be activated (unfortunately).;Claim
491:19;Jupyter_Lab_4945;#4590;Premise
491:20;Jupyter_Lab_4945;Fixed;Claim
492:4;Jupyter_Lab_5294;"jupyter notebook not workingHI! I dont know what I did to my file but now it looks like this:";Claim
492:5;Jupyter_Lab_5294;I dont know how to fix it!!!! how do I get it back to normal;Claim
492:6;Jupyter_Lab_5294;<img;Premise
492:7;Jupyter_Lab_5294;Closing;Claim
492:8;Jupyter_Lab_5294;as answered.;Premise
492:9;Jupyter_Lab_5294;![image](https://user-images.githubusercontent.com/6224509/45401663-b3b49d80-b61f-11e8-9d79-136357449001.png);Premise
492:10;Jupyter_Lab_5294;"To fix, you should really just have to double click on the file in the jupyterlab file browser widget.If for some reason that doesn't work, you can right click on the file and select ""notebook"" to force it to open in the notebook view.";Claim
493:2;Jupyter_Lab_5354;" suggested popping up a link in an untrusted notebook (perhaps until the first cell is run?), allowing a user to trust that single notebook. Such a link could have a short explanation, e.g., ""This notebook has been sanitized to be safely viewed. <Trust this notebook> or run the cells to see the unsanitized content."" or something (that text definitely needs some wordsmithing)";Non-Argument
493:3;Jupyter_Lab_5354;"The status bar shows the trusted status and could offer an interaction forthe trusting..";Claim
493:6;Jupyter_Lab_5354;I think it is a sufficiently advanced and not-used feature that perhaps we shouldn't complicate the menu system with this menu item.;Claim
493:7;Jupyter_Lab_5354;I've put a lot of thought into this and discussed it with @Zsailer at length.;Claim
493:8;Jupyter_Lab_5354;We will have the notion of trust displayed on the status bar. I do agree that dealing with the notion of trust in the status bar is a good idea.;Claim
493:9;Jupyter_Lab_5354;I'm not opposed to taking it out of the file system if we do testing that suggests user's aren't it in the file menu but they are in other locations (command palette, status bar).;Claim
493:10;Jupyter_Lab_5354;The 'popping up' idea is useful if our goal is to highlight trust, and get people familiar with it;Claim
493:11;Jupyter_Lab_5354;I think a menu item is more innocuous than a link overlayed on a notebook. I do think there's merit to giving a warning in the menu-bar, with an option to trust, but again, only if we are trying to highlight the trust mechanism.;Claim
