ID;Num_Doc;Statement;Type
400:8;CoCalc_4706;I just checked and I can see that nbgrader genuinely fails to solve your problem (as you said);Claim
400:9;CoCalc_4706;since the contents of === BEGIN MARK SCHEME ===  ... gets replaced by a message telling the student to insert their answer.;Premise
400:10;CoCalc_4706;"Implementing what you want is not difficult.  It's just ""annoying""";Claim
400:11;CoCalc_4706;because it is a nonstandard extension to nbgrader, so if you use it then you can't use the same stuff with nbgrader.  Oh well, such is life.;Premise
400:12;CoCalc_4706;it'll likely get implemented this week in a way that is NOT compatible with upstream nbgrader.;Claim
400:13;CoCalc_4706;if you do not use this cell type this field is not set in the nbgrader metadata,;Claim
400:14;CoCalc_4706;, so things should still work fine.  This only matters if you develop notebooks in cocalc, then use them with nbgrader entirely outside of cocalc. There's also a warning about this in our UI.;Premise
400:15;CoCalc_4706;"If you use this cell type there is a new field `""remove"":true`, which should totally break upstream nbgrader (good).";Claim
400:16;CoCalc_4706;See upstream ticket: https://github.com/jupyter/nbgrader/issues/1342;Premise
401:2;CoCalc_4772;Instead of an image, can you paste the actual characters here.;Non-Argument
401:4;CoCalc_4772;I don't know why it looks so weird in the rendered view.  In codemirror it looks fine.  I'll leave this for now, but it is weird for me, very weird.;Claim
401:5;CoCalc_4772;![image;Premise
401:6;CoCalc_4772;"<img width=""493"" alt=""ballot-box-checked-verdana"" src=""https://user-images.githubusercontent.com/528072/88844231-fba72400-d1a7-11ea-9e2a-5c4db148c485.png"">";Premise
401:7;CoCalc_4772;"use BALLOT BOX WITH CHECK instead of BALLOT BOX WITH BOLD CHECK for checked boxes in md, etcThis is how the two characters appear with Verdana on macOS 10.1.5 with Chrome configured to use Verdana as the default font.";Claim
402:1;CoCalc_4898;"Clarify ""Last active"" date in ""Stopped project"" dialogSince recently, logging into a stopped project one sees this message:> **Stopped**> Project is available and ready to try to run.  (26/09/2020, 17:15:26)> [ Start project ]followed by the list of files in the project.(Thank you so much for implementing that. I wanted to ask that forever.)The date and time in parentheses probably correspond to the last timethe project was active? If so, add the words ""Last active"" so one sees:> **Stopped**> Project is available and ready to try to run.> (Last active: 26/09/2020, 17:15:26)> [ Start project ]";Non-Argument
403:2;CoCalc_4981;This was surely caused by me trying to port this code to antd (from bootstrap).;Claim
403:3;CoCalc_4981;"I fixed this";Claim
403:4;CoCalc_4981;something strange must have happened with div/col/row/whatever :thinking:;Claim
403:5;CoCalc_4981;Screenshot;Premise
404:1;CoCalc_5062;"cocalc-jupyter: provide a jupyter command line console frame (connected to the same kernel)";Claim
404:4;CoCalc_5062;"I don't expect this to get used much, but it also wasn't hard to implement.";Claim
404:5;CoCalc_5062;It seems like a fun little feature in some edge case situations, and I can't imagine somebody working on Jupyterlab didn't already do something similar?;Claim
404:6;CoCalc_5062;did you see this?  It's a one click way to get a command line Jupyter console connected to the same kernel as a notebook.  And if the notebook kernel is restarted it automatically points itself at the new kernel;Premise
404:7;CoCalc_5062;You can even start editing Python code and use it in either place:;Claim
404:8;CoCalc_5062;"To use this, just click the ""Console"" button at the top of a cocalc-Jupyter notebook!  That's it.  Super easy.";Premise
404:9;CoCalc_5062;"![image](https://user-images.githubusercontent.com/1276278/101110497-eeeb7000-358d-11eb-992e-9fccebf3fc90.png)Now I can use the left like a normal notebook, and I can use the right side like a command line terminal, but they are using the same kernel (so same variables).  It's the best of both worlds (notebook and command line).";Premise
404:10;CoCalc_5062;![image](https://user-images.githubusercontent.com/1276278/101110620-3a9e1980-358e-11eb-8977-b692f16fd216.png);Premise
405:3;CoCalc_5118;This is a major usability issue.;Claim
405:4;CoCalc_5118;"iPad: run buttons in Sage worksheets and Jupyter notebooks in portrait mode1. The run button disappears on an iPad in portrait mode with a Sage worksheet.  It is there when in landscape mode.";Premise
405:5;CoCalc_5118;This is a minor usability issue.;Claim
405:6;CoCalc_5118;"2. Jupyter notebooks do have the run button in portrait mode, though the word ""Run"" is hidden, which makes the button small and harder to click.";Premise
405:7;CoCalc_5118;", this is because Jupyter classic never has the word ""Run"" for the run button, since it is NOT mobile friendly, so they don't need to use the run button much.";Premise
406:3;Google_Colab_11;Ah, I take back my comment about `smartLists`: this doesn't seem to help, unfortunately.;Claim
406:5;Google_Colab_11;Inappropriate starting index in ordered list;Claim
406:6;Google_Colab_11;"![image](https://user-images.githubusercontent.com/5977817/34364003-aedddc26-eac4-11e7-9164-b6faf16a1a74.png)Related specification: [start number](http://spec.commonmark.org/0.27/#start-number). Minimal example:2. second itemRendered as:1. second item";Premise
406:7;Google_Colab_11;We use marked.js, not commonmark;Claim
406:8;Google_Colab_11;so this is (unfortunately) working as intended.;Premise
406:9;Google_Colab_11;It's possible that the [smartLists](https://github.com/chjj/marked#smartlists) option could make this work, but we'd have to set that in the UI (you couldn't do it yourself);Claim
406:10;Google_Colab_11;More info on markdown in colab is in [this sample notebook];Premise
406:11;Google_Colab_11;It's possible that the [smartLists](https://github.com/chjj/marked#smartlists) option could make this work;Claim
406:12;Google_Colab_11;This is a limitation of marked.js,;Claim
406:13;Google_Colab_11;"see: https://github.com/chjj/marked/issues/665.A workaround is to use an HTML ordered list in the markdown:";Premise
407:1;Google_Colab_92;"it stays initializingmy network broke when i was running colab.i reconnected and return to colab, press connect. the status is initializing and stay here for tens of minutes.how to reset the status?";Non-Argument
407:2;Google_Colab_92;connected now;Non-Argument
408:2;Google_Colab_171;This has been fixed.;Claim
408:4;Google_Colab_171;I would love for them to remain closed,;Claim
408:5;Google_Colab_171;Perhaps an alternative behavior could be opening the section with right-arrow?;Claim
408:8;Google_Colab_171;Collapsed sections currently expand;Claim
408:9;Google_Colab_171;: hidden cells don't open when down-arrowing over them;Claim
408:11;Google_Colab_171;I would love for them to remain closed;Claim
408:14;Google_Colab_171;"This is currently the behavior of cells with a ""form"",";Claim
408:15;Google_Colab_171;"This is currently the behavior of cells with a ""form""";Claim
408:16;Google_Colab_171;to avoid having to use the mouse to skip them;Premise
409:2;Google_Colab_204;"My plot don't show correctly, with the same code, show diferentThis colab is a person and the plot is the correct";Claim
409:3;Google_Colab_204;my result is very diferent;Claim
409:4;Google_Colab_204;https://colab.research.google.com/drive/1PUrYIyFWxL-NYm_Ys1VCMiAhJRsTzL6U#scrollTo=5rcRmmtxrGTN&forceEdit=true&offline=true&sandboxMode=true;Premise
409:5;Google_Colab_204;https://colab.research.google.com/drive/1r-N4wwubRWH3_mioUTSFUOD9Y4dK62_L;Premise
410:2;Google_Colab_253;any update on this one?;Non-Argument
410:5;Google_Colab_253;any update on this one?;Non-Argument
410:8;Google_Colab_253;@RamsteinWR  Interesting, do you have to crash before you can have more RAM?;Non-Argument
410:9;Google_Colab_253;Yes. As for how, I was inspecting my data and it maxed out my allocated RAM.;Non-Argument
410:11;Google_Colab_253;Google Colab gives free 25 Gb as Ram space. But for my model I need 64 Gb. How can I increase the memory space? Can I buy the rest and How?;Non-Argument
410:13;Google_Colab_253;"Thanks ziatdinovmax for reply,Do you know any link or tutorial for doing that?";Non-Argument
410:14;Google_Colab_253;Sure, see e.g.;Non-Argument
410:15;Google_Colab_253;"For people searching for the problem, I hope this might help you outyou can just load a very large dataset into the ram,1. Download and Unzip a huge dataset2. Read the dataset into a var* Colab will crash and show you a message asking if you want to use their High Ram Option3. Click yes of courseand voilà";Non-Argument
410:16;Google_Colab_253;"Just crashed Colab via this code:```d=[]while(1):d.append('1')```Indeed, a message shows up, asking if you want to increase RAM usage. RAM is then upgraded to 35GB.";Non-Argument
410:17;Google_Colab_253;Thanks in advance, a messagebox shows up and then I have 25.51GB of RAM;Non-Argument
410:18;Google_Colab_253;"Thank you !you save my day";Non-Argument
410:21;Google_Colab_253;thats very true. thank you. have a great year ahead;Non-Argument
410:22;Google_Colab_253;Actually, if you chose to change the runtime type from GPU to TPU, you will get 35.35 Gb instead of 25.5Gb;Non-Argument
410:23;Google_Colab_253;"Thank you Chanaa will follow your advice by changing to TPU.Can you kindly suggest (any other console) if i would like to work onhigher than 35.35 GB for faster output.That would be highly appreciative, Thanks in advance.With best regardsAbhishek";Non-Argument
410:24;Google_Colab_253;Does not work any more;Non-Argument
410:25;Google_Colab_253;Does not show the message;Non-Argument
410:26;Google_Colab_253;The problem is that in my case that is 12.75 Gb;Non-Argument
410:27;Google_Colab_253;"Colab Pro (which I am using) allows one to select between low (~12 GB) andhigh (~25 GB) RAM for any notebook. Highly recommend.";Non-Argument
410:28;Google_Colab_253;"Even I get the message ""View Runtime Logs"" instead of ""Get more RAM"".I am still using 12GB and not 25GB.Please can somebody help with this?";Non-Argument
410:29;Google_Colab_253;I think this issue needs to be re-opened @craigcitro;Claim
410:30;Google_Colab_253;"Unfortunately, I think they closed the ""loophole""";Claim
410:31;Google_Colab_253;is it possible to increase the memory limit.;Claim
410:32;Google_Colab_253;. 11G is too small. Can't really do much.;Premise
410:33;Google_Colab_253;My data is huge.;Claim
410:34;Google_Colab_253;After the 12.72 GB RAM is maxed out, I immediately get the prompt of crash and option to increase my RAM.;Premise
410:36;Google_Colab_253;Maybe Colab limits the Session to a maximum of 25Gb.;Claim
410:37;Google_Colab_253;Perhaps you want to optimize the solution rather than increasing the amount of RAM.;Claim
410:38;Google_Colab_253;I think we can't ask for more;Claim
410:39;Google_Colab_253;"Isn't 25.5Gb free a great thing ;)";Premise
410:41;Google_Colab_253;"We don't have any support for changing the resource footprint of a managed runtime at this point.You can always [connect to a local backend](https://research.google.com/colaboratory/local-runtimes.html).";Non-Argument
410:43;Google_Colab_253;Any idea how to increase memory size?;Non-Argument
410:46;Google_Colab_253;@RamsteinWR is right.;Claim
410:47;Google_Colab_253;"Just click on ""Get more RAM"" and you would be able to work on a 25Gbs instance. Not sure if it is still free?";Premise
410:48;Google_Colab_253;"In my experience, the easiest way to get more computational recourseswithout leaving your Colab notebook is to create a GCP deep learning VMwith larger memory and more powerful GPU(s) and then connect to thatinstance from the Colab notebook.";Claim
410:49;Google_Colab_253;"in my experience the best way to ""purchase"" additional RAM and/or faster GPUs in Colab is by connecting (from Colab notebook) to a deep learning VM on GCP where you can adjust specs of your instance each time before launching it.";Claim
410:50;Google_Colab_253;I made a short video on this a few weeks ago: https://drive.google.com/file/d/1ijawhI6AuPXxWhLu8flkrHZPTu3o_zF0/view?usp=sharing;Premise
410:51;Google_Colab_253;![screenshot-colab research google com-2019 08 05-00_53_17](https://user-images.githubusercontent.com/46052567/62428147-c9412300-b71b-11e9-9954-8e392a2857b7.png);Premise
410:53;Google_Colab_253;I've tried a lot of different ways.;Premise
410:54;Google_Colab_253;Believe me;Claim
410:55;Google_Colab_253;Maybe Colab limits the Session to a maximum of 25Gb;Claim
410:56;Google_Colab_253;As far as I know: Nope.;Claim
410:57;Google_Colab_253;I'm happy about that.;Claim
410:58;Google_Colab_253;![Screenshot (2)](https://user-images.githubusercontent.com/57695875/71618963-097fd100-2be8-11ea-9af3-a9a456d1d076.png);Premise
410:59;Google_Colab_253;Can you help me how to increase my RAM from 25.5GB to higher limi;Claim
410:60;Google_Colab_253;Just crash your session by using the whole of the 12.5 Gigs of RAM then the door opens where you can directly double your RAM to 25 Gigs in Colab.;Claim
411:1;Google_Colab_346;presentation mode (RISE / reveal.js)?;Non-Argument
411:3;Google_Colab_346;"Agreed, but the question I asked on SO was back from April 2018";Claim
411:4;Google_Colab_346;Duplicate to;Claim
411:5;Google_Colab_346;https://github.com/googlecolab/colabtools/issues/241;Premise
412:4;Google_Colab_420;"<img width=""670"" alt=""screen shot 2019-02-08 at 4 01 27 pm"" src=""https://user-images.githubusercontent.com/37666064/52505974-228c2780-2bbb-11e9-9e8e-d2f647f26057.png"">Here's the notebook: http://www.cs.toronto.edu/~rgrosse/courses/csc421_2019/tutorials/tut4/tut4.ipyn";Premise
412:5;Google_Colab_420;"Error uploading and opening ipython notebookI am getting the below error when I try to upload the notebook ""tut4.ipynb"" to my Colaboratory account using the ""Upload"" option, and I am unable to troubleshoot it. The notebook displays well in Jupyter. Others around me aren't encountering the same error.";Claim
412:6;Google_Colab_420;I downloaded it and changed the extension to .ipynb but nothing;Claim
413:2;Google_Colab_426;Having the same problem here. I tried 'reset all runtimes' but still doesn't work;Claim
413:3;Google_Colab_426;same issue here;Claim
413:4;Google_Colab_426;Just connected now;Non-Argument
413:5;Google_Colab_426;Sorry for the trouble, all. Colab should again be working for all users. Do let us know if the issue recurs.;Claim
413:7;Google_Colab_426;Not Allocating Runtime;Claim
413:8;Google_Colab_426;The notebook is not able to connect to a runtime and it just shows allocating.;Claim
413:9;Google_Colab_426;same issue here;Claim
413:10;Google_Colab_426;i keep facing this issue every now n;Claim
413:11;Google_Colab_426;one or two time if due to internet it disconnects there after it takes long time for notebook to get connected;Premise
414:1;Google_Colab_438;"Editing ""collapsed_sections"" from within Colab editorCan we get a way of choosing which sections are hidden on startup? Right now I can get sections to start collapsed by editing the ""collapsed_sections"" metadata in the raw ipynb file, but I can't get that metadata to change just by editing the notebook in Colab.";Non-Argument
414:3;Google_Colab_438; Yeah, it works after saving. I noticed this the other day and meant to close the issue but forgot!;Non-Argument
414:4;Google_Colab_438;The section state should be saved as part of notebook save.;Claim
415:2;Google_Colab_489;Colab ipynb preview stopped working in github repo;Claim
416:1;Google_Colab_533;"Allow changing font size and picking font type inside the code cellBug report for Colab: http://colab.research.google.com/.For questions about colab usage, please use [stackoverflow](https://stackoverflow.com/questions/tagged/google-colaboratory/).- Describe the current behavior: The current Colab version as of (05/01) does not allow increasing either the font size, or picking the font inside the code cells. While this can be somewhat remedied by zooming in, that increases the size of _all_ the other elements on the page.- Describe the expected behavior: Allow increasing font size, picking font etc. within the code cell.- The web browser you are using (Chrome, Firefox, Safari, etc.): Chrome- Link to self-contained notebook that reproduces this issue(click the *Share* button, then *Get Shareable Link*): N/A";Non-Argument
416:2;Google_Colab_533;"+1 for thisthe font size is too small for code cell";Claim
416:5;Google_Colab_533;The new editor does have a slightly larger font size:;Claim
416:6;Google_Colab_533;Typically browser zoom is used to increase all fonts together.;Claim
416:7;Google_Colab_533;You can specify what font is being used by the editor;Claim
416:8;Google_Colab_533;You can now also specify the font size via Tools -> Settings -> Editor;Claim
416:9;Google_Colab_533;Is it possible to change the font type?;Non-Argument
417:2;Google_Colab_534;"Thanks for the report. We'll take a look.";Non-Argument
417:3;Google_Colab_534;"This has been fixed.";Claim
417:5;Google_Colab_534;"When entering ?whatever into a card and running it, a bar on the bottom pops up with a ""Help"" tab and the help documentation for whatever. If that text happens to be longer than the box, it doesn't scroll and you can only see more by making the box bigger";Claim
417:6;Google_Colab_534;image](https://user-images.githubusercontent.com/7376078/57031697-3f099000-6bfd-11e9-96bf-772929c9e205.png);Premise
417:7;Google_Colab_534;This would be reasonably acceptable normal behavior over no scroll bar at all, of course.;Claim
417:9;Google_Colab_534;![image](https://user-images.githubusercontent.com/7376078/57031764-72e4b580-6bfd-11e9-9fa7-e01f6e685cc3.png);Premise
417:10;Google_Colab_534;Help window text doesn't scroll;Claim
417:11;Google_Colab_534;Tested in Chrome and Firefox;Claim
417:12;Google_Colab_534;. Preferably, however, for a number of reasons it would be nice to be able to run help commands and have the help results pin to the bottom of the card like any other results;Claim
418:7;Google_Colab_541;The iframe itself should always be limited to the width of the window;Claim
418:8;Google_Colab_541;", I'm guessing you're looking to wrap text within the iframe rather than horizontally scroll?An example of that is:";Premise
418:9;Google_Colab_541;Otherwise you should be able to use HTML styling within the outputframe to further constrain the rendering sizes;Claim
418:10;Google_Colab_541;In either way, the approach in the link worked.;Claim
418:11;Google_Colab_541;the solution in pre-wrapping.ipynb example must be used in every cell that prints horizontally long outputs.;Claim
418:12;Google_Colab_541;One of the solutions here ( [https://stackoverflow.com/questions/32156248/how-do-i-set-custom-css-for-my-ipython-ihaskell-jupyter-notebook](https://stackoverflow.com/questions/32156248/how-do-i-set-custom-css-for-my-ipython-ihaskell-jupyter-notebook) ) suggests editing the local file ~/.jupyter/custom/custom.css.;Claim
418:13;Google_Colab_541;I tried creating a file '/usr/local/share/jupyter/custom/custom.css' from within a colab notebook, but it doesn't get read prior to the notebook starting up, and is thus useless;Claim
418:14;Google_Colab_541;Disabling auto-scroll of outputs;Claim
418:15;Google_Colab_541;"Yes- the maximum height is 1000px but this can be overriden by executing the Javascript:```javascriptgoogle.colab.output.setIframeHeight(0, true, {maxHeight: 5000,})```An example in Python:";Premise
418:16;Google_Colab_541;"If I want to shrink the width of the output then? To keep it within the width of the window for example.I've tried various variants of below code but without success.";Claim
418:17;Google_Colab_541;"`from IPython.display import Javascriptdisplay(Javascript('''google.colab.output.setIframeWidth(0, true, {maxWidth: 500})'''))`";Premise
418:20;Google_Colab_541;Inspired by numerous stackoverflow posts, I have come to a solution;Claim
418:21;Google_Colab_541;https://stackoverflow.com/questions/58890109/line-wrapping-in-collaboratory-google-results/61401455#61401455;Premise
418:22;Google_Colab_541;The solution I have come to is to put the following in the first cell of the notebook. Then every cell afterwards will execute the css snippet inside the `set_css()` function.;Claim
418:23;Google_Colab_541;from IPython.display import HTML, display;Premise
419:2;Google_Colab_547;Thanks for the report, we'll take a look - b/132516361;Non-Argument
419:4;Google_Colab_547;Thanks. I guess that means it still will be the same on my end until it goes live ?;Non-Argument
419:5;Google_Colab_547;This should be live now! Sorry about the delay, please let me know if you're still seeing this;Claim
419:9;Google_Colab_547;Cant scroll the page the way;Claim
419:11;Google_Colab_547;we've fixed it internally and hope to see it live before the end of the week. I'll post here again once I've confirmed it's live.;Claim
419:12;Google_Colab_547;It works again.;Claim
419:13;Google_Colab_547;It works now;Claim
419:14;Google_Colab_547;Looks good;Claim
419:15;Google_Colab_547;I used to be able to hit the escape key and the three dots in the cell would go away and lock the page so I could scroll up and down with the arrow keys. now It just doesn't respond when I hit the escape key, and I can only scroll from cell to cell.  I tried it with both current chrome and firefox.;Premise
419:16;Google_Colab_547;![Capture15](https://user-images.githubusercontent.com/8146561/57576453-e1532000-7414-11e9-8da6-7b4fe7d3b201.PNG);Premise
420:2;Google_Colab_589;"Thanks for the request- outputs should now be auto-scrolling to the end.";Non-Argument
420:3;Google_Colab_589;is it possible to add autoscroll to the bottom of output by default, just like in terminal?;Claim
420:4;Google_Colab_589;currently, it needs to be done manually in google colab by using the scroll bar.;Claim
421:3;Google_Colab_617;"We're working on updating the editor engine and have fixed a couple of issues around path completions. Details can be found at https://colab.research.google.com/notebooks/editor_details.ipynb.";Non-Argument
421:4;Google_Colab_617;"After pressing Enter to select the path suggested by auto-complete, the auto-complete suggestion should ""replace"" and not ""append"" to the path entered ""before"" tabbing.";Claim
421:5;Google_Colab_617;"The image below shows, how after performing a dot-dot-slash (or for that matter dot-slash) and tabbing (or ctrl+space), and then selecting the resulting auto path by pressing ""Enter"" results in duplicate appearance, thus turning it into dot-dot-dot-dot-slash.![image";Premise
421:6;Google_Colab_617;"On rare occasions this issue is ""not"" reproducible.";Claim
421:7;Google_Colab_617;No logical inference can be drawn about when that is.;Premise
421:8;Google_Colab_617;Otherwise, most times this issue is reproducible. Furthermore, to the best of my knowledge, this behavior wasn't seen some months ago. ;Claim
421:10;Google_Colab_617;"have been getting used to that nagging feeling of not conveniently being able to use auto-complete of paths. I hope select ""Enter"" is the right method? Because that is how it is in most linux based auto-complete systems.";Premise
421:11;Google_Colab_617;"I hope select ""Enter"" is the right method? Because that is how it is in most linux based auto-complete systems.";Premise
422:3;Google_Colab_636;Feature Request: Show blank spaces, or vertical lines, or any other visualizer of indentations;Claim
422:5;Google_Colab_636;"My favorite is different column highlights for each tab, which I haven't seen in a while so I don't have an exact pic of this. But the first left tabs will always be one color , next tab will be another, etc. I made a quick mock up of what I'm trying to describehttps://snag.gy/8GNXs2.jpg";Premise
422:7;Google_Colab_636;I would love to have some sort of visualization of the indentations in Google colab, to more easily  comprehend what code belongs to what functions and classes.;Claim
422:8;Google_Colab_636;Showing/highlighting the spaces/tabs are also something I've seen in IDEs.;Claim
422:9;Google_Colab_636;![image](https://user-images.githubusercontent.com/2152569/61968479-00316f00-af8d-11e9-9330-f7407f519400.png);Premise
422:10;Google_Colab_636;If you enable the new editor then there will be a preference in the Editor section 'Show indentation guides' which will display the indentation.;Claim
422:11;Google_Colab_636;Vertical lines are a classic way to do this.;Premise
422:12;Google_Colab_636;https://snag.gy/R02NzM.jpg;Premise
423:1;Google_Colab_789;Running two notebooks in the same runtime environment.;Claim
424:6;Google_Colab_805;I'm unable to reproduce this behavior.;Claim
424:8;Google_Colab_805;s it just started happening, tab used to give tab earlier, but now it takes cursor to next cell.;Claim
424:9;Google_Colab_805;I'm just brainstorming at this point- could be a Chrome version upgrade, or perhaps a new browser extension (try incognito mode for that).;Claim
424:10;Google_Colab_805;I'm pretty sure;Claim
424:11;Google_Colab_805;there have not been any changes in Colab in the past 3 days which would have affected this.;Premise
424:12;Google_Colab_805;someway got resolved on its own.;Claim
424:13;Google_Colab_805;I reloaded, tab started working as expected.;Premise
424:14;Google_Colab_805;"tab takes to next cell instead of tabwhen I press tab, it takes cursor to next cell, instead of using tab for spaces.";Claim
424:15;Google_Colab_805;[tab.zip](https://github.com/googlecolab/colabtools/files/3730028/tab.zip);Premise
